question,answer,topic
Tell me about the Duqm Port investment opportunity.,"Port of Duqm is receiving a $550 million FDI, focusing on marine upgrades and green steel production, aligned with Oman’s Vision 2040.",Tell me about the Duqm Port investment opportunity.
What is Sultan Haitham City?,"Sultan Haitham City is a brand-new planned community in Seeb designed to house 100,000 residents with expansive green space and modern infrastructure.",What is Sultan Haitham City?
How much investment were Oman’s free zones attracting?,"By the end of 2024, special economic and free zones in Oman attracted around OMR 21 billion in investment, marking a 10% annual growth.",How much investment were Oman’s free zones attracting?
Can you tell me about Jebel Sifah’s development?,"Jebel Sifah is a massive integrated tourism complex by Omran, featuring over 950 homes, hotels, a golf course, and a 200-berth marina.",Can you tell me about Jebel Sifah’s development?
What is the investment potential of Hawana Salalah?,"Hawana Salalah comprises over 1,150 luxury units, golf courses, hotels, and retail facilities — an attractive tourism and real estate investment by Omran.",What is the investment potential of Hawana Salalah?
Why should investors consider Oman Vision 2040?,"Vision 2040 focuses on economic diversification, industrial reform, and sustainable development — offering public–private partnerships and reforms favorable to investors.",Why should investors consider Oman Vision 2040?
What's the investment plan for tourism by 2040?,"Oman plans to invest US$31 billion in its tourism sector by 2040, aligned with Vision 2040 goals.",What's the investment plan for tourism by 2040?
How many tourism projects are underway?,"Currently, over 360 tourism projects are being implemented, receiving more than US$5.9 billion in investment.",How many tourism projects are underway?
What’s the expected investment in the heritage and tourism sector by 2025?,"For 2021–2025, the heritage and tourism sector investment is expected to reach OMR 3 billion, with ~33,000 hotel rooms planned.",What’s the expected investment in the heritage and tourism sector by 2025?
Tell me about the Jebel Al Akhdar tourist project.,"Jebel Al Akhdar will see a $2.4 billion mountain resort development featuring 2,527 homes, 2,000 hotel rooms, a wellness village, museum, and sustainability initiatives.",Tell me about the Jebel Al Akhdar tourist project.
Is there investment in Musandam tourism?,"Yes—in Musandam, Club Med is developing a resort spanning 250,000 m² with private beaches, for over $100 million.",Is there investment in Musandam tourism?
What is Omran investing in tourism?,Omran plans to invest US$3 billion over five years in strategic tourism projects and has attracted nearly US$2 billion in foreign investments.,What is Omran investing in tourism?
How much do hotels contribute to GDP?,"In 2023, tourism contributed RO 2.8 billion in GDP; expected to reach RO 3.3 billion (~7.6% of economy) in 2024.",How much do hotels contribute to GDP?
How many tourists visit Oman now and in the future?,Oman welcomed 4 million tourists in 2023; targets to reach 11 million by 2040.,How many tourists visit Oman now and in the future?
What’s happening with airports for tourism?,"Oman plans to build six new airports by 2029 to boost tourism, increasing airport capacity significantly.",What’s happening with airports for tourism?
What’s the Green Mountain project?,"The ‘Green Mountain’ at Jebel Akhdar includes £1.87 billion in development—housing, hotels, wellness center, cable car, and eco-leisure spaces.",What’s the Green Mountain project?
Tell me about the Seeb Marina project.,"Seeb Marina includes luxury apartments, retail spaces, and a yacht club, designed to attract foreign investors and tourists.",Tell me about the Seeb Marina project.
What is the Dhofar adventure park investment?,"Dhofar Adventure Park features zip lines, climbing walls, and eco-camping, with an estimated investment of OMR 2 million and annual returns of 12%.",What is the Dhofar adventure park investment?
Can you explain the Hawana Salalah resort investment?,"The resort comprises over 1,150 luxury units, golf courses, and hotels, attracting high-end tourism and real estate investors.",Can you explain the Hawana Salalah resort investment?
Tell me about the Jebel Al Akhdar wellness village.,"The wellness village offers spa resorts, hiking trails, and eco-friendly accommodation, part of a $2.4 billion investment project.",Tell me about the Jebel Al Akhdar wellness village.
What is the investment in Muscat Marina Yacht Club?,"The Marina includes 300 berths, retail, and dining, with projected annual returns of 11% for investors.",What is the investment in Muscat Marina Yacht Club?
How is Oman encouraging tourism investment?,"Through Vision 2040, Oman provides tax incentives, infrastructure development, and public-private partnerships for tourism projects.",How is Oman encouraging tourism investment?
Tell me about the Al Mouj Muscat residential project.,"Al Mouj features luxury apartments, hotels, and recreational facilities, targeting both residents and international tourists.",Tell me about the Al Mouj Muscat residential project.
What is the investment in Jebel Sifah?,"Jebel Sifah is a mixed-use tourism complex with over 950 homes, golf courses, and a marina, with $500 million in expected investment.",What is the investment in Jebel Sifah?
Can you describe the Musandam resort project?,"A seaside resort spanning 250,000 m² with private beaches, restaurants, and hotels, attracting both tourists and high-net-worth investors.",Can you describe the Musandam resort project?
What are the main sectors in Oman’s tourism investment?,"Main sectors include leisure resorts, cultural tourism, eco-tourism, adventure parks, and marina developments.",What are the main sectors in Oman’s tourism investment?
How many luxury hotels are planned in Oman by 2025?,"Approximately 33,000 hotel rooms are expected, focusing on high-end tourism and heritage sites.",How many luxury hotels are planned in Oman by 2025?
Tell me about the Al Bustan Palace extension.,"Al Bustan Palace is expanding its hotel capacity and adding conference facilities, enhancing Muscat’s tourism appeal.",Tell me about the Al Bustan Palace extension.
What is the investment in Salalah coastal resorts?,"Salalah is seeing $1.5 billion in luxury coastal resorts, combining tourism and real estate opportunities.",What is the investment in Salalah coastal resorts?
Can you explain eco-tourism investments in Oman?,"Eco-tourism projects include mountain lodges, desert camps, and heritage village experiences, emphasizing sustainability and local culture.",Can you explain eco-tourism investments in Oman?
Tell me about cultural tourism initiatives.,"Oman promotes heritage villages, traditional crafts, and music festivals, attracting cultural tourists and supporting local communities.",Tell me about cultural tourism initiatives.
What can you tell me about the Duqm Port investment opportunity?,"Port of Duqm is receiving a $550 million FDI, focusing on marine upgrades and green steel production, aligned with Oman’s Vision 2040.",Tell me about the Duqm Port investment opportunity.
Tell me about Sultan Haitham City.,"Sultan Haitham City is a brand-new planned community in Seeb designed to house 100,000 residents with expansive green space and modern infrastructure.",What is Sultan Haitham City?
What can you tell me about Sultan Haitham City?,"Sultan Haitham City is a brand-new planned community in Seeb designed to house 100,000 residents with expansive green space and modern infrastructure.",What is Sultan Haitham City?
Tell me about How much investment were Oman’s free zones attracting.,"By the end of 2024, special economic and free zones in Oman attracted around OMR 21 billion in investment, marking a 10% annual growth.",How much investment were Oman’s free zones attracting?
What can you tell me about How much investment were Oman’s free zones attracting?,"By the end of 2024, special economic and free zones in Oman attracted around OMR 21 billion in investment, marking a 10% annual growth.",How much investment were Oman’s free zones attracting?
Tell me about Jebel Sifah’s development.,"Jebel Sifah is a massive integrated tourism complex by Omran, featuring over 950 homes, hotels, a golf course, and a 200-berth marina.",Can you tell me about Jebel Sifah’s development?
What can you tell me about Jebel Sifah’s development?,"Jebel Sifah is a massive integrated tourism complex by Omran, featuring over 950 homes, hotels, a golf course, and a 200-berth marina.",Can you tell me about Jebel Sifah’s development?
Tell me about the investment potential of Hawana Salalah.,"Hawana Salalah comprises over 1,150 luxury units, golf courses, hotels, and retail facilities — an attractive tourism and real estate investment by Omran.",What is the investment potential of Hawana Salalah?
What can you tell me about the investment potential of Hawana Salalah?,"Hawana Salalah comprises over 1,150 luxury units, golf courses, hotels, and retail facilities — an attractive tourism and real estate investment by Omran.",What is the investment potential of Hawana Salalah?
Tell me about Why should investors consider Oman Vision 2040.,"Vision 2040 focuses on economic diversification, industrial reform, and sustainable development — offering public–private partnerships and reforms favorable to investors.",Why should investors consider Oman Vision 2040?
What can you tell me about Why should investors consider Oman Vision 2040?,"Vision 2040 focuses on economic diversification, industrial reform, and sustainable development — offering public–private partnerships and reforms favorable to investors.",Why should investors consider Oman Vision 2040?
Tell me about What's the investment plan for tourism by 2040.,"Oman plans to invest US$31 billion in its tourism sector by 2040, aligned with Vision 2040 goals.",What's the investment plan for tourism by 2040?
What can you tell me about What's the investment plan for tourism by 2040?,"Oman plans to invest US$31 billion in its tourism sector by 2040, aligned with Vision 2040 goals.",What's the investment plan for tourism by 2040?
Tell me about How many tourism projects are underway.,"Currently, over 360 tourism projects are being implemented, receiving more than US$5.9 billion in investment.",How many tourism projects are underway?
What can you tell me about How many tourism projects are underway?,"Currently, over 360 tourism projects are being implemented, receiving more than US$5.9 billion in investment.",How many tourism projects are underway?
Tell me about What’s the expected investment in the heritage and tourism sector by 2025.,"For 2021–2025, the heritage and tourism sector investment is expected to reach OMR 3 billion, with ~33,000 hotel rooms planned.",What’s the expected investment in the heritage and tourism sector by 2025?
What can you tell me about What’s the expected investment in the heritage and tourism sector by 2025?,"For 2021–2025, the heritage and tourism sector investment is expected to reach OMR 3 billion, with ~33,000 hotel rooms planned.",What’s the expected investment in the heritage and tourism sector by 2025?
What can you tell me about the Jebel Al Akhdar tourist project?,"Jebel Al Akhdar will see a $2.4 billion mountain resort development featuring 2,527 homes, 2,000 hotel rooms, a wellness village, museum, and sustainability initiatives.",Tell me about the Jebel Al Akhdar tourist project.
Tell me about Is there investment in Musandam tourism.,"Yes—in Musandam, Club Med is developing a resort spanning 250,000 m² with private beaches, for over $100 million.",Is there investment in Musandam tourism?
What can you tell me about Is there investment in Musandam tourism?,"Yes—in Musandam, Club Med is developing a resort spanning 250,000 m² with private beaches, for over $100 million.",Is there investment in Musandam tourism?
Tell me about Omran investing in tourism.,Omran plans to invest US$3 billion over five years in strategic tourism projects and has attracted nearly US$2 billion in foreign investments.,What is Omran investing in tourism?
What can you tell me about Omran investing in tourism?,Omran plans to invest US$3 billion over five years in strategic tourism projects and has attracted nearly US$2 billion in foreign investments.,What is Omran investing in tourism?
Tell me about How much do hotels contribute to GDP.,"In 2023, tourism contributed RO 2.8 billion in GDP; expected to reach RO 3.3 billion (~7.6% of economy) in 2024.",How much do hotels contribute to GDP?
What can you tell me about How much do hotels contribute to GDP?,"In 2023, tourism contributed RO 2.8 billion in GDP; expected to reach RO 3.3 billion (~7.6% of economy) in 2024.",How much do hotels contribute to GDP?
Tell me about How many tourists visit Oman now and in the future.,Oman welcomed 4 million tourists in 2023; targets to reach 11 million by 2040.,How many tourists visit Oman now and in the future?
What can you tell me about How many tourists visit Oman now and in the future?,Oman welcomed 4 million tourists in 2023; targets to reach 11 million by 2040.,How many tourists visit Oman now and in the future?
Tell me about What’s happening with airports for tourism.,"Oman plans to build six new airports by 2029 to boost tourism, increasing airport capacity significantly.",What’s happening with airports for tourism?
What can you tell me about What’s happening with airports for tourism?,"Oman plans to build six new airports by 2029 to boost tourism, increasing airport capacity significantly.",What’s happening with airports for tourism?
Tell me about What’s the Green Mountain project.,"The ‘Green Mountain’ at Jebel Akhdar includes £1.87 billion in development—housing, hotels, wellness center, cable car, and eco-leisure spaces.",What’s the Green Mountain project?
What can you tell me about What’s the Green Mountain project?,"The ‘Green Mountain’ at Jebel Akhdar includes £1.87 billion in development—housing, hotels, wellness center, cable car, and eco-leisure spaces.",What’s the Green Mountain project?
What can you tell me about the Seeb Marina project?,"Seeb Marina includes luxury apartments, retail spaces, and a yacht club, designed to attract foreign investors and tourists.",Tell me about the Seeb Marina project.
Tell me about the Dhofar adventure park investment.,"Dhofar Adventure Park features zip lines, climbing walls, and eco-camping, with an estimated investment of OMR 2 million and annual returns of 12%.",What is the Dhofar adventure park investment?
What can you tell me about the Dhofar adventure park investment?,"Dhofar Adventure Park features zip lines, climbing walls, and eco-camping, with an estimated investment of OMR 2 million and annual returns of 12%.",What is the Dhofar adventure park investment?
Tell me about Can you explain the Hawana Salalah resort investment.,"The resort comprises over 1,150 luxury units, golf courses, and hotels, attracting high-end tourism and real estate investors.",Can you explain the Hawana Salalah resort investment?
What can you tell me about Can you explain the Hawana Salalah resort investment?,"The resort comprises over 1,150 luxury units, golf courses, and hotels, attracting high-end tourism and real estate investors.",Can you explain the Hawana Salalah resort investment?
What can you tell me about the Jebel Al Akhdar wellness village?,"The wellness village offers spa resorts, hiking trails, and eco-friendly accommodation, part of a $2.4 billion investment project.",Tell me about the Jebel Al Akhdar wellness village.
Tell me about the investment in Muscat Marina Yacht Club.,"The Marina includes 300 berths, retail, and dining, with projected annual returns of 11% for investors.",What is the investment in Muscat Marina Yacht Club?
What can you tell me about the investment in Muscat Marina Yacht Club?,"The Marina includes 300 berths, retail, and dining, with projected annual returns of 11% for investors.",What is the investment in Muscat Marina Yacht Club?
Tell me about How is Oman encouraging tourism investment.,"Through Vision 2040, Oman provides tax incentives, infrastructure development, and public-private partnerships for tourism projects.",How is Oman encouraging tourism investment?
What can you tell me about How is Oman encouraging tourism investment?,"Through Vision 2040, Oman provides tax incentives, infrastructure development, and public-private partnerships for tourism projects.",How is Oman encouraging tourism investment?
What can you tell me about the Al Mouj Muscat residential project?,"Al Mouj features luxury apartments, hotels, and recreational facilities, targeting both residents and international tourists.",Tell me about the Al Mouj Muscat residential project.
Tell me about the investment in Jebel Sifah.,"Jebel Sifah is a mixed-use tourism complex with over 950 homes, golf courses, and a marina, with $500 million in expected investment.",What is the investment in Jebel Sifah?
What can you tell me about the investment in Jebel Sifah?,"Jebel Sifah is a mixed-use tourism complex with over 950 homes, golf courses, and a marina, with $500 million in expected investment.",What is the investment in Jebel Sifah?
Tell me about Can you describe the Musandam resort project.,"A seaside resort spanning 250,000 m² with private beaches, restaurants, and hotels, attracting both tourists and high-net-worth investors.",Can you describe the Musandam resort project?
What can you tell me about Can you describe the Musandam resort project?,"A seaside resort spanning 250,000 m² with private beaches, restaurants, and hotels, attracting both tourists and high-net-worth investors.",Can you describe the Musandam resort project?
Tell me about What are the main sectors in Oman’s tourism investment.,"Main sectors include leisure resorts, cultural tourism, eco-tourism, adventure parks, and marina developments.",What are the main sectors in Oman’s tourism investment?
What can you tell me about What are the main sectors in Oman’s tourism investment?,"Main sectors include leisure resorts, cultural tourism, eco-tourism, adventure parks, and marina developments.",What are the main sectors in Oman’s tourism investment?
Tell me about How many luxury hotels are planned in Oman by 2025.,"Approximately 33,000 hotel rooms are expected, focusing on high-end tourism and heritage sites.",How many luxury hotels are planned in Oman by 2025?
What can you tell me about How many luxury hotels are planned in Oman by 2025?,"Approximately 33,000 hotel rooms are expected, focusing on high-end tourism and heritage sites.",How many luxury hotels are planned in Oman by 2025?
What can you tell me about the Al Bustan Palace extension?,"Al Bustan Palace is expanding its hotel capacity and adding conference facilities, enhancing Muscat’s tourism appeal.",Tell me about the Al Bustan Palace extension.
Tell me about the investment in Salalah coastal resorts.,"Salalah is seeing $1.5 billion in luxury coastal resorts, combining tourism and real estate opportunities.",What is the investment in Salalah coastal resorts?
What can you tell me about the investment in Salalah coastal resorts?,"Salalah is seeing $1.5 billion in luxury coastal resorts, combining tourism and real estate opportunities.",What is the investment in Salalah coastal resorts?
Tell me about Can you explain eco-tourism investments in Oman.,"Eco-tourism projects include mountain lodges, desert camps, and heritage village experiences, emphasizing sustainability and local culture.",Can you explain eco-tourism investments in Oman?
What can you tell me about Can you explain eco-tourism investments in Oman?,"Eco-tourism projects include mountain lodges, desert camps, and heritage village experiences, emphasizing sustainability and local culture.",Can you explain eco-tourism investments in Oman?
What can you tell me about cultural tourism initiatives?,"Oman promotes heritage villages, traditional crafts, and music festivals, attracting cultural tourists and supporting local communities.",Tell me about cultural tourism initiatives.
